{
  "schema_version": "v0.1",
  "note_id": "note_2026_04_17_001",
  "turn_id": "turn_2026_04_17_001",
  "scope": "session",
  "goal": "整理一个可公开发布的 companion meta-skill 技术骨架",
  "actions": "提炼协议、改写公开文档、清洗样例、保留验证脚本和 runtime 合同",
  "result": "公开版保留了可移植架构与技术实现，没有携带个性化设置或真实记忆",
  "candidate_points": [
    "未来可从私有真源导出公开投影",
    "未来可把 hooks 只作为发布前校验闸门"
  ],
  "retention": "short"
}
